ts	Tsonga	tso	0	Large Bantu language, Regional LWC, 3m+ L2 between Zim and Moz, supplemental to English/Portuguese, not enough numerical support for RL 1 or 2		
uk	Ukrainian	ukr	0	Not enough numerical support for RL 1 or 2, access through other major languages		Cyrl
xh	Xhosa	xho	0	Large language of Southern Africa but enough secondary access to English		Latn
dje	Zarma	dje	0	Regional LWC Niger. Unsure supplemental potential, but limited, not enough numerical support for RL 1		
zu	Zulu	zul	0	Large language of Southern Africa but enough secondary access to English to limit additional translational value		
be	Belarusian	bel	0	"Not enough numerical support for RL 1, supplemental to other major languages (ie Russian)
"		Cyrl
